PMID,Year,Title,short_author,short_citation,link,full_authors,full_citation
31729152,2020,Deep Profiling of Cellular Heterogeneity by Emerging Single-Cell Proteomic Technologies.,"Yang L, et al.",Proteomics. 2020.,https://pubmed.ncbi.nlm.nih.gov/31729152/,"Yang L, George J, Wang J.",Proteomics. 2020 Jul;20(13):e1900226. doi: 10.1002/pmic.201900226. Epub 2019 Dec 2.
31722205,2019,Mass Cytometry Reveals Global Immune Remodeling with Multi-lineage Hypersensitivity to Type I Interferon in Down Syndrome.,"Waugh KA, et al.",Cell Rep. 2019.,https://pubmed.ncbi.nlm.nih.gov/31722205/,"Waugh KA, Araya P, Pandey A, Jordan KR, Smith KP, Granrath RE, Khanal S, Butcher ET, Estrada BE, Rachubinski AL, McWilliams JA, Minter R, Dimasi T, Colvin KL, Baturin D, Pham AT, Galbraith MD, Bartsch KW, Yeager ME, Porter CC, Sullivan KD, Hsieh EW, Espinosa JM.",Cell Rep. 2019 Nov 12;29(7):1893-1908.e4. doi: 10.1016/j.celrep.2019.10.038.
31722123,2020,"Anti-TNF treatment negatively regulates human CD4+ T-cell activation and maturation in vitro, but does not confer an anergic or suppressive phenotype.","Povoleri GAM, et al.",Eur J Immunol. 2020.,https://pubmed.ncbi.nlm.nih.gov/31722123/,"Povoleri GAM, Lalnunhlimi S, Steel KJA, Agrawal S, O'Byrne AM, Ridley M, Kordasti S, Frederiksen KS, Roberts CA, Taams LS.",Eur J Immunol. 2020 Mar;50(3):445-458. doi: 10.1002/eji.201948190. Epub 2019 Dec 3.
31714901,2020,Defective glycosylation and multisystem abnormalities characterize the primary immunodeficiency XMEN disease.,"Ravell JC, et al.",J Clin Invest. 2020.,https://pubmed.ncbi.nlm.nih.gov/31714901/,"Ravell JC, Matsuda-Lennikov M, Chauvin SD, Zou J, Biancalana M, Deeb SJ, Price S, Su HC, Notarangelo G, Jiang P, Morawski A, Kanellopoulou C, Binder K, Mukherjee R, Anibal JT, Sellers B, Zheng L, He T, George AB, Pittaluga S, Powers A, Kleiner DE, Kapuria D, Ghany M, Hunsberger S, Cohen JI, Uzel G, Bergerson J, Wolfe L, Toro C, Gahl W, Folio LR, Matthews H, Angelus P, Chinn IK, Orange JS, Trujillo-Vargas CM, Franco JL, Orrego-Arango J, Gutiérrez-Hincapié S, Patel NC, Raymond K, Patiroglu T, Unal E, Karakukcu M, Day AG, Mehta P, Masutani E, De Ravin SS, Malech HL, Altan-Bonnet G, Rao VK, Mann M, Lenardo MJ.",J Clin Invest. 2020 Jan 2;130(1):507-522. doi: 10.1172/JCI131116.
31708922,2019,Pregnancy-Induced Alterations in NK Cell Phenotype and Function.,"Le Gars M, et al.",Front Immunol. 2019.,https://pubmed.ncbi.nlm.nih.gov/31708922/,"Le Gars M, Seiler C, Kay AW, Bayless NL, Starosvetsky E, Moore L, Shen-Orr SS, Aziz N, Khatri P, Dekker CL, Swan GE, Davis MM, Holmes S, Blish CA.",Front Immunol. 2019 Oct 23;10:2469. doi: 10.3389/fimmu.2019.02469. eCollection 2019.
31704709,2019,TRAIL-induced variation of cell signaling states provides nonheritable resistance to apoptosis.,"Baskar R, et al.",Life Sci Alliance. 2019.,https://pubmed.ncbi.nlm.nih.gov/31704709/,"Baskar R, Fienberg HG, Khair Z, Favaro P, Kimmey S, Green DR, Nolan GP, Plevritis S, Bendall SC.",Life Sci Alliance. 2019 Nov 8;2(6):e201900554. doi: 10.26508/lsa.201900554. Print 2019 Dec.
31699819,2019,Trisomy 21 dysregulates T cell lineages toward an autoimmunity-prone state associated with interferon hyperactivity.,"Araya P, et al.",Proc Natl Acad Sci U S A. 2019.,https://pubmed.ncbi.nlm.nih.gov/31699819/,"Araya P, Waugh KA, Sullivan KD, Núñez NG, Roselli E, Smith KP, Granrath RE, Rachubinski AL, Enriquez Estrada B, Butcher ET, Minter R, Tuttle KD, Bruno TC, Maccioni M, Espinosa JM.",Proc Natl Acad Sci U S A. 2019 Nov 26;116(48):24231-24241. doi: 10.1073/pnas.1908129116. Epub 2019 Nov 7.
31693335,2019,Signal Amplification for Imaging Mass Cytometry.,"Rana R, et al.",Bioconjug Chem. 2019.,https://pubmed.ncbi.nlm.nih.gov/31693335/,"Rana R, Gómez-Biagi RF, Bassan J, Nitz M.",Bioconjug Chem. 2019 Nov 20;30(11):2805-2810. doi: 10.1021/acs.bioconjchem.9b00559. Epub 2019 Nov 6.
31692248,2019,Challenges in the Multivariate Analysis of Mass Cytometry Data: The Effect of Randomization.,"Papoutsoglou G, et al.",Cytometry A. 2019.,https://pubmed.ncbi.nlm.nih.gov/31692248/,"Papoutsoglou G, Lagani V, Schmidt A, Tsirlis K, Cabrero DG, Tegnér J, Tsamardinos I.",Cytometry A. 2019 Nov;95(11):1178-1190. doi: 10.1002/cyto.a.23908. Epub 2019 Nov 6.
31684853,2019,Flex-Array® - a novel multi-well vessel system for the immobilization and multi-modal testing of intact formalin-fixed paraffin-embedded (FFPE) cells or tissues.,"Genty C, et al.",J Histotechnol. 2019.,https://pubmed.ncbi.nlm.nih.gov/31684853/,"Genty C, McDonnell TJ.",J Histotechnol. 2019 Dec;42(4):215-225. doi: 10.1080/01478885.2019.1679470. Epub 2019 Nov 4.
31683098,2019,Characterization of mesoangioblast cell fate and improved promyogenic potential of a satellite cell-like subpopulation upon transplantation in dystrophic murine muscles.,"Mavoungou LO, et al.",Stem Cell Res. 2019.,https://pubmed.ncbi.nlm.nih.gov/31683098/,"Mavoungou LO, Neuenschwander S, Pham U, Iyer PS, Mermod N.",Stem Cell Res. 2019 Dec;41:101619. doi: 10.1016/j.scr.2019.101619. Epub 2019 Oct 25.
31681279,2019,Characterization of Phenotypes and Functional Activities of Leukocytes From Rheumatoid Arthritis Patients by Mass Cytometry.,"Leite Pereira A, et al.",Front Immunol. 2019.,https://pubmed.ncbi.nlm.nih.gov/31681279/,"Leite Pereira A, Bitoun S, Paoletti A, Nocturne G, Marcos Lopez E, Cosma A, Le Grand R, Mariette X, Tchitchek N.",Front Immunol. 2019 Oct 18;10:2384. doi: 10.3389/fimmu.2019.02384. eCollection 2019.
31681275,2019,Minimizing Batch Effects in Mass Cytometry Data.,"Schuyler RP, et al.",Front Immunol. 2019.,https://pubmed.ncbi.nlm.nih.gov/31681275/,"Schuyler RP, Jackson C, Garcia-Perez JE, Baxter RM, Ogolla S, Rochford R, Ghosh D, Rudra P, Hsieh EWY.",Front Immunol. 2019 Oct 15;10:2367. doi: 10.3389/fimmu.2019.02367. eCollection 2019.
31661488,2019,Cell generation dynamics underlying naive T-cell homeostasis in adult humans.,"Mold JE, et al.",PLoS Biol. 2019.,https://pubmed.ncbi.nlm.nih.gov/31661488/,"Mold JE, Réu P, Olin A, Bernard S, Michaëlsson J, Rane S, Yates A, Khosravi A, Salehpour M, Possnert G, Brodin P, Frisén J.",PLoS Biol. 2019 Oct 29;17(10):e3000383. doi: 10.1371/journal.pbio.3000383. eCollection 2019 Oct.
31645649,2020,Anti-inflammatory mechanisms of the novel cytokine interleukin-38 in allergic asthma.,"Sun X, et al.",Cell Mol Immunol. 2020.,https://pubmed.ncbi.nlm.nih.gov/31645649/,"Sun X, Hou T, Cheung E, Iu TN, Tam VW, Chu IM, Tsang MS, Chan PK, Lam CW, Wong CK.",Cell Mol Immunol. 2020 Jun;17(6):631-646. doi: 10.1038/s41423-019-0300-7. Epub 2019 Oct 23.
31637838,2020,Single Cell Phenotypic Profiling of 27 DLBCL Cases Reveals Marked Intertumoral and Intratumoral Heterogeneity.,"Nissen MD, et al.",Cytometry A. 2020.,https://pubmed.ncbi.nlm.nih.gov/31637838/,"Nissen MD, Kusakabe M, Wang X, Simkin G, Gracias D, Tyshchenko K, Hill A, Meskas J, Hung S, Chavez EA, Ennishi D, Aoki T, Sarkozy C, Connors JM, Farinha P, Slack GW, Gascoyne RD, Brinkman RR, Scott DW, Steidl C, Weng AP.",Cytometry A. 2020 Jun;97(6):620-629. doi: 10.1002/cyto.a.23919. Epub 2019 Oct 22.
31637475,2019,Pembrolizumab for anaplastic thyroid cancer: a case study.,"Aghajani MJ, et al.",Cancer Immunol Immunother. 2019.,https://pubmed.ncbi.nlm.nih.gov/31637475/,"Aghajani MJ, Cooper A, McGuire H, Jeffries T, Saab J, Ismail K, de Souza P, Bray V, Fazekas de St Groth B, Niles N, Roberts TL.",Cancer Immunol Immunother. 2019 Dec;68(12):1921-1934. doi: 10.1007/s00262-019-02416-7. Epub 2019 Oct 22.
31636632,2019,Mind the Map: Technology Shapes the Myeloid Cell Space.,"Günther P, et al.",Front Immunol. 2019.,https://pubmed.ncbi.nlm.nih.gov/31636632/,"Günther P, Schultze JL.",Front Immunol. 2019 Oct 4;10:2287. doi: 10.3389/fimmu.2019.02287. eCollection 2019.
31636208,2019,Combination anti-CTLA-4 plus anti-PD-1 checkpoint blockade utilizes cellular mechanisms partially distinct from monotherapies.,"Wei SC, et al.",Proc Natl Acad Sci U S A. 2019.,https://pubmed.ncbi.nlm.nih.gov/31636208/,"Wei SC, Anang NAS, Sharma R, Andrews MC, Reuben A, Levine JH, Cogdill AP, Mancuso JJ, Wargo JA, Pe'er D, Allison JP.",Proc Natl Acad Sci U S A. 2019 Nov 5;116(45):22699-22709. doi: 10.1073/pnas.1821218116. Epub 2019 Oct 21.
31633883,2020,CytoNorm: A Normalization Algorithm for Cytometry Data.,"Van Gassen S, et al.",Cytometry A. 2020.,https://pubmed.ncbi.nlm.nih.gov/31633883/,"Van Gassen S, Gaudilliere B, Angst MS, Saeys Y, Aghaeepour N.",Cytometry A. 2020 Mar;97(3):268-278. doi: 10.1002/cyto.a.23904. Epub 2019 Oct 21.
31633216,2019,Guidelines for the use of flow cytometry and cell sorting in immunological studies (second edition).,"Cossarizza A, et al.",Eur J Immunol. 2019.,https://pubmed.ncbi.nlm.nih.gov/31633216/,"Cossarizza A, Chang HD, Radbruch A, Acs A, Adam D, Adam-Klages S, Agace WW, Aghaeepour N, Akdis M, Allez M, Almeida LN, Alvisi G, Anderson G, Andrä I, Annunziato F, Anselmo A, Bacher P, Baldari CT, Bari S, Barnaba V, Barros-Martins J, Battistini L, Bauer W, Baumgart S, Baumgarth N, Baumjohann D, Baying B, Bebawy M, Becher B, Beisker W, Benes V, Beyaert R, Blanco A, Boardman DA, Bogdan C, Borger JG, Borsellino G, Boulais PE, Bradford JA, Brenner D, Brinkman RR, Brooks AES, Busch DH, Büscher M, Bushnell TP, Calzetti F, Cameron G, Cammarata I, Cao X, Cardell SL, Casola S, Cassatella MA, Cavani A, Celada A, Chatenoud L, Chattopadhyay PK, Chow S, Christakou E, Čičin-Šain L, Clerici M, Colombo FS, Cook L, Cooke A, Cooper AM, Corbett AJ, Cosma A, Cosmi L, Coulie PG, Cumano A, Cvetkovic L, Dang VD, Dang-Heine C, Davey MS, Davies D, De Biasi S, Del Zotto G, Dela Cruz GV, Delacher M, Della Bella S, Dellabona P, Deniz G, Dessing M, Di Santo JP, Diefenbach A, Dieli F, Dolf A, Dörner T, Dress RJ, Dudziak D, Dustin M, Dutertre CA, Ebner F, Eckle SBG, Edinger M, Eede P, Ehrhardt GRA, Eich M, Engel P, Engelhardt B, Erdei A, Esser C, Everts B, Evrard M, Falk CS, Fehniger TA, Felipo-Benavent M, Ferry H, Feuerer M, Filby A, Filkor K, Fillatreau S, Follo M, Förster I, Foster J, Foulds GA, Frehse B, Frenette PS, Frischbutter S, Fritzsche W, Galbraith DW, Gangaev A, Garbi N, Gaudilliere B, Gazzinelli RT, Geginat J, Gerner W, Gherardin NA, Ghoreschi K, Gibellini L, Ginhoux F, Goda K, Godfrey DI, Goettlinger C, González-Navajas JM, Goodyear CS, Gori A, Grogan JL, Grummitt D, Grützkau A, Haftmann C, Hahn J, Hammad H, Hämmerling G, Hansmann L, Hansson G, Harpur CM, Hartmann S, Hauser A, Hauser AE, Haviland DL, Hedley D, Hernández DC, Herrera G, Herrmann M, Hess C, Höfer T, Hoffmann P, Hogquist K, Holland T, Höllt T, Holmdahl R, Hombrink P, Houston JP, Hoyer BF, Huang B, Huang FP, Huber JE, Huehn J, Hundemer M, Hunter CA, Hwang WYK, Iannone A, Ingelfinger F, Ivison SM, Jäck HM, Jani PK, Jávega B, Jonjic S, Kaiser T, Kalina T, Kamradt T, Kaufmann SHE, Keller B, Ketelaars SLC, Khalilnezhad A, Khan S, Kisielow J, Klenerman P, Knopf J, Koay HF, Kobow K, Kolls JK, Kong WT, Kopf M, Korn T, Kriegsmann K, Kristyanto H, Kroneis T, Krueger A, Kühne J, Kukat C, Kunkel D, Kunze-Schumacher H, Kurosaki T, Kurts C, Kvistborg P, Kwok I, Landry J, Lantz O, Lanuti P, LaRosa F, Lehuen A, LeibundGut-Landmann S, Leipold MD, Leung LYT, Levings MK, Lino AC, Liotta F, Litwin V, Liu Y, Ljunggren HG, Lohoff M, Lombardi G, Lopez L, López-Botet M, Lovett-Racke AE, Lubberts E, Luche H, Ludewig B, Lugli E, Lunemann S, Maecker HT, Maggi L, Maguire O, Mair F, Mair KH, Mantovani A, Manz RA, Marshall AJ, Martínez-Romero A, Martrus G, Marventano I, Maslinski W, Matarese G, Mattioli AV, Maueröder C, Mazzoni A, McCluskey J, McGrath M, McGuire HM, McInnes IB, Mei HE, Melchers F, Melzer S, Mielenz D, Miller SD, Mills KHG, Minderman H, Mjösberg J, Moore J, Moran B, Moretta L, Mosmann TR, Müller S, Multhoff G, Muñoz LE, Münz C, Nakayama T, Nasi M, Neumann K, Ng LG, Niedobitek A, Nourshargh S, Núñez G, O'Connor JE, Ochel A, Oja A, Ordonez D, Orfao A, Orlowski-Oliver E, Ouyang W, Oxenius A, Palankar R, Panse I, Pattanapanyasat K, Paulsen M, Pavlinic D, Penter L, Peterson P, Peth C, Petriz J, Piancone F, Pickl WF, Piconese S, Pinti M, Pockley AG, Podolska MJ, Poon Z, Pracht K, Prinz I, Pucillo CEM, Quataert SA, Quatrini L, Quinn KM, Radbruch H, Radstake TRDJ, Rahmig S, Rahn HP, Rajwa B, Ravichandran G, Raz Y, Rebhahn JA, Recktenwald D, Reimer D, Reis e Sousa C, Remmerswaal EBM, Richter L, Rico LG, Riddell A, Rieger AM, Robinson JP, Romagnani C, Rubartelli A, Ruland J, Saalmüller A, Saeys Y, Saito T, Sakaguchi S, Sala-de-Oyanguren F, Samstag Y, Sanderson S, Sandrock I, Santoni A, Sanz RB, Saresella M, Sautes-Fridman C, Sawitzki B, Schadt L, Scheffold A, Scherer HU, Schiemann M, Schildberg FA, Schimisky E, Schlitzer A, Schlosser J, Schmid S, Schmitt S, Schober K, Schraivogel D, Schuh W, Schüler T, Schulte R, Schulz AR, Schulz SR, Scottá C, Scott-Algara D, Sester DP, Shankey TV, Silva-Santos B, Simon AK, Sitnik KM, Sozzani S, Speiser DE, Spidlen J, Stahlberg A, Stall AM, Stanley N, Stark R, Stehle C, Steinmetz T, Stockinger H, Takahama Y, Takeda K, Tan L, Tárnok A, Tiegs G, Toldi G, Tornack J, Traggiai E, Trebak M, Tree TIM, Trotter J, Trowsdale J, Tsoumakidou M, Ulrich H, Urbanczyk S, van de Veen W, van den Broek M, van der Pol E, Van Gassen S, Van Isterdael G, van Lier RAW, Veldhoen M, Vento-Asturias S, Vieira P, Voehringer D, Volk HD, von Borstel A, von Volkmann K, Waisman A, Walker RV, Wallace PK, Wang SA, Wang XM, Ward MD, Ward-Hartstonge KA, Warnatz K, Warnes G, Warth S, Waskow C, Watson JV, Watzl C, Wegener L, Weisenburger T, Wiedemann A, Wienands J, Wilharm A, Wilkinson RJ, Willimsky G, Wing JB, Winkelmann R, Winkler TH, Wirz OF, Wong A, Wurst P, Yang JHM, Yang J, Yazdanbakhsh M, Yu L, Yue A, Zhang H, Zhao Y, Ziegler SM, Zielinski C, Zimmermann J, Zychlinsky A.",Eur J Immunol. 2019 Oct;49(10):1457-1973. doi: 10.1002/eji.201970107.
31629741,2020,Whole blood preservation methods alter chemokine receptor detection in mass cytometry experiments.,"Sakkestad ST, et al.",J Immunol Methods. 2020.,https://pubmed.ncbi.nlm.nih.gov/31629741/,"Sakkestad ST, Skavland J, Hanevik K.",J Immunol Methods. 2020 Jan;476:112673. doi: 10.1016/j.jim.2019.112673. Epub 2019 Oct 17.
31620139,2019,Increased T Cell Differentiation and Cytolytic Function in Bangladeshi Compared to American Children.,"Wagar LE, et al.",Front Immunol. 2019.,https://pubmed.ncbi.nlm.nih.gov/31620139/,"Wagar LE, Bolen CR, Sigal N, Lopez Angel CJ, Guan L, Kirkpatrick BD, Haque R, Tibshirani RJ, Parsonnet J, Petri WA Jr, Davis MM.",Front Immunol. 2019 Sep 20;10:2239. doi: 10.3389/fimmu.2019.02239. eCollection 2019.
31607651,2019,Maturation of the Human Intestinal Immune System Occurs Early in Fetal Development.,"Stras SF, et al.",Dev Cell. 2019.,https://pubmed.ncbi.nlm.nih.gov/31607651/,"Stras SF, Werner L, Toothaker JM, Olaloye OO, Oldham AL, McCourt CC, Lee YN, Rechavi E, Shouval DS, Konnikova L.",Dev Cell. 2019 Nov 4;51(3):357-373.e5. doi: 10.1016/j.devcel.2019.09.008. Epub 2019 Oct 10.
31600167,2019,Metronomic capecitabine as an immune modulator in glioblastoma patients reduces myeloid-derived suppressor cells.,"Peereboom DM, et al.",JCI Insight. 2019.,https://pubmed.ncbi.nlm.nih.gov/31600167/,"Peereboom DM, Alban TJ, Grabowski MM, Alvarado AG, Otvos B, Bayik D, Roversi G, McGraw M, Huang P, Mohammadi AM, Kornblum HI, Radivoyevitch T, Ahluwalia MS, Vogelbaum MA, Lathia JD.",JCI Insight. 2019 Nov 14;4(22):e130748. doi: 10.1172/jci.insight.130748.
31591579,2019,Exploring single-cell data with deep multitasking neural networks.,"Amodio M, et al.",Nat Methods. 2019.,https://pubmed.ncbi.nlm.nih.gov/31591579/,"Amodio M, van Dijk D, Srinivasan K, Chen WS, Mohsen H, Moon KR, Campbell A, Zhao Y, Wang X, Venkataswamy M, Desai A, Ravi V, Kumar P, Montgomery R, Wolf G, Krishnaswamy S.",Nat Methods. 2019 Nov;16(11):1139-1145. doi: 10.1038/s41592-019-0576-7. Epub 2019 Oct 7.
31582391,2019,High-efficiency CRISPR induction of t(9;11) chromosomal translocations and acute leukemias in human blood stem cells.,"Jeong J, et al.",Blood Adv. 2019.,https://pubmed.ncbi.nlm.nih.gov/31582391/,"Jeong J, Jager A, Domizi P, Pavel-Dinu M, Gojenola L, Iwasaki M, Wei MC, Pan F, Zehnder JL, Porteus MH, Davis KL, Cleary ML.",Blood Adv. 2019 Oct 8;3(19):2825-2835. doi: 10.1182/bloodadvances.2019000450.
31579809,2019,Circulating B Cells With Memory and Antibody-Secreting Phenotypes Are Detectable in Pediatric Kidney Transplant Recipients Before the Development of Antibody-Mediated Rejection.,"Fischman C, et al.",Transplant Direct. 2019.,https://pubmed.ncbi.nlm.nih.gov/31579809/,"Fischman C, Fribourg M, Fabrizio G, Cioni M, Comoli P, Nocera A, Cardillo M, Cantarelli C, Gallon L, Petrosyan A, Da Sacco S, Perin L, Cravedi P.",Transplant Direct. 2019 Aug 8;5(9):e481. doi: 10.1097/TXD.0000000000000914. eCollection 2019 Sep.
31577949,2019,Modeling Cell-Cell Interactions from Spatial Molecular Data with Spatial Variance Component Analysis.,"Arnol D, et al.",Cell Rep. 2019.,https://pubmed.ncbi.nlm.nih.gov/31577949/,"Arnol D, Schapiro D, Bodenmiller B, Saez-Rodriguez J, Stegle O.",Cell Rep. 2019 Oct 1;29(1):202-211.e6. doi: 10.1016/j.celrep.2019.08.077.
31577391,2019,An R-Derived FlowSOM Process to Analyze Unsupervised Clustering of Normal and Malignant Human Bone Marrow Classical Flow Cytometry Data.,"Lacombe F, et al.",Cytometry A. 2019.,https://pubmed.ncbi.nlm.nih.gov/31577391/,"Lacombe F, Lechevalier N, Vial JP, Béné MC.",Cytometry A. 2019 Nov;95(11):1191-1197. doi: 10.1002/cyto.a.23897. Epub 2019 Oct 2.
31570522,2019,Mass cytometry-based single-cell analysis of human stem cell reprogramming uncovers differential regulation of specific pluripotency markers.,"Im I, et al.",J Biol Chem. 2019.,https://pubmed.ncbi.nlm.nih.gov/31570522/,"Im I, Son YS, Jung KB, Kang I, Teh BE, Lee KB, Son MY, Kim J.",J Biol Chem. 2019 Dec 6;294(49):18547-18556. doi: 10.1074/jbc.RA119.009061. Epub 2019 Sep 30.
31553459,2020,Short-term sleep deprivation in mice induces B cell migration to the brain compartment.,"Korin B, et al.",Sleep. 2020.,https://pubmed.ncbi.nlm.nih.gov/31553459/,"Korin B, Avraham S, Azulay-Debby H, Farfara D, Hakim F, Rolls A.",Sleep. 2020 Feb 13;43(2):zsz222. doi: 10.1093/sleep/zsz222.
31544564,2020,Platelet surface marker analysis by mass cytometry.,"Blair TA, et al.",Platelets. 2020.,https://pubmed.ncbi.nlm.nih.gov/31544564/,"Blair TA, Frelinger AL 3rd.",Platelets. 2020 Jul 3;31(5):633-640. doi: 10.1080/09537104.2019.1668549. Epub 2019 Sep 22.
31543877,2019,Human Monocyte Subsets and Phenotypes in Major Chronic Inflammatory Diseases.,"Kapellos TS, et al.",Front Immunol. 2019.,https://pubmed.ncbi.nlm.nih.gov/31543877/,"Kapellos TS, Bonaguro L, Gemünd I, Reusch N, Saglam A, Hinkley ER, Schultze JL.",Front Immunol. 2019 Aug 30;10:2035. doi: 10.3389/fimmu.2019.02035. eCollection 2019.
31541232,2020,Transcriptomic Analysis and High-dimensional Phenotypic Mapping of Mononuclear Phagocytes in Mesenteric Lymph Nodes Reveal Differences Between Ulcerative Colitis and Crohn's Disease.,"Chapuy L, et al.",J Crohns Colitis. 2020.,https://pubmed.ncbi.nlm.nih.gov/31541232/,"Chapuy L, Bsat M, Rubio M, Harvey F, Motta V, Schwenter F, Wassef R, Richard C, Deslandres C, Nguyen BN, Soucy G, Hacohen N, Fritz J, Villani AC, Mehta H, Sarfati M.",J Crohns Colitis. 2020 Mar 13;14(3):393-405. doi: 10.1093/ecco-jcc/jjz156.
31540934,2019,Immunome perturbation is present in patients with juvenile idiopathic arthritis who are in remission and will relapse upon anti-TNFα withdrawal.,"Leong JY, et al.",Ann Rheum Dis. 2019.,https://pubmed.ncbi.nlm.nih.gov/31540934/,"Leong JY, Chen P, Yeo JG, Ally F, Chua C, Nur Hazirah S, Poh SL, Pan L, Lai L, Lee ESC, Bathi LDT, Arkachaisri T, Lovell D, Albani S; Pediatric Rheumatology Collaborative Study Group.",Ann Rheum Dis. 2019 Dec;78(12):1712-1721. doi: 10.1136/annrheumdis-2019-216059. Epub 2019 Sep 20.
31533030,2019,Mapping the Lineage Relationship between CXCR5+ and CXCR5- CD4+ T Cells in HIV-Infected Human Lymph Nodes.,"Del Alcazar D, et al.",Cell Rep. 2019.,https://pubmed.ncbi.nlm.nih.gov/31533030/,"Del Alcazar D, Wang Y, He C, Wendel BS, Del Río-Estrada PM, Lin J, Ablanedo-Terrazas Y, Malone MJ, Hernandez SM, Frank I, Naji A, Reyes-Terán G, Jiang N, Su LF.",Cell Rep. 2019 Sep 17;28(12):3047-3060.e7. doi: 10.1016/j.celrep.2019.08.037.
31527554,2019,Single Cell Mass Cytometry of Non-Small Cell Lung Cancer Cells Reveals Complexity of In vivo And Three-Dimensional Models over the Petri-dish.,"Alföldi R, et al.",Cells. 2019.,https://pubmed.ncbi.nlm.nih.gov/31527554/,"Alföldi R, Balog JÁ, Faragó N, Halmai M, Kotogány E, Neuperger P, Nagy LI, Fehér LZ, Szebeni GJ, Puskás LG.",Cells. 2019 Sep 16;8(9):1093. doi: 10.3390/cells8091093.
31522415,2019,Strategies and Techniques for NK Cell Phenotyping.,"Ziqing C, et al.",Methods Mol Biol. 2019.,https://pubmed.ncbi.nlm.nih.gov/31522415/,"Ziqing C, Lundqvist A, Witt K.",Methods Mol Biol. 2019;2032:105-114. doi: 10.1007/978-1-4939-9650-6_6.
31522411,2019,Immunophenotyping by Mass Cytometry.,Behbehani GK.,Methods Mol Biol. 2019.,https://pubmed.ncbi.nlm.nih.gov/31522411/,Behbehani GK.,Methods Mol Biol. 2019;2032:31-51. doi: 10.1007/978-1-4939-9650-6_2.
31522410,2019,High-Dimensional Immunophenotyping with Fluorescence-Based Cytometry: A Practical Guidebook.,"Mair F, et al.",Methods Mol Biol. 2019.,https://pubmed.ncbi.nlm.nih.gov/31522410/,"Mair F, Tyznik AJ.",Methods Mol Biol. 2019;2032:1-29. doi: 10.1007/978-1-4939-9650-6_1.
31520102,2019,Skin platinum deposition in colorectal cancer patients following oxaliplatin-based therapy.,"Cao Y, et al.",Cancer Chemother Pharmacol. 2019.,https://pubmed.ncbi.nlm.nih.gov/31520102/,"Cao Y, Chang Q, Zhang W, Ornatsky O, Hedley D, Chen EX.",Cancer Chemother Pharmacol. 2019 Dec;84(6):1195-1200. doi: 10.1007/s00280-019-03956-6. Epub 2019 Sep 13.
31515541,2019,Next-generation computational tools for interrogating cancer immunity.,"Finotello F, et al.",Nat Rev Genet. 2019.,https://pubmed.ncbi.nlm.nih.gov/31515541/,"Finotello F, Rieder D, Hackl H, Trajanoski Z.",Nat Rev Genet. 2019 Dec;20(12):724-746. doi: 10.1038/s41576-019-0166-7. Epub 2019 Sep 12.
31514680,2019,Proteomic tools and new insights for the study of B-cell precursor acute lymphoblastic leukemia.,"Citalan-Madrid AF, et al.",Hematology. 2019.,https://pubmed.ncbi.nlm.nih.gov/31514680/,"Citalan-Madrid AF, Cabral-Pacheco GA, Martinez-de-Villarreal LE, Villarreal-Martinez L, Ibarra-Ramirez M, Garza-Veloz I, Cardenas-Vargas E, Marino-Martinez I, Martinez-Fierro ML.",Hematology. 2019 Dec;24(1):637-650. doi: 10.1080/16078454.2019.1664127.
31511834,2019,Mass cytometry reveals species-specific differences and a new level of complexity for immune cells in the prostate.,"Fox JJ, et al.",Am J Clin Exp Urol. 2019.,https://pubmed.ncbi.nlm.nih.gov/31511834/,"Fox JJ, Navarro HI, Hashimoto T, Garcia AJ, Goldstein AS.",Am J Clin Exp Urol. 2019 Aug 15;7(4):281-296. eCollection 2019.
31511069,2019,Late-differentiated effector neoantigen-specific CD8+ T cells are enriched in peripheral blood of non-small cell lung carcinoma patients responding to atezolizumab treatment.,"Fehlings M, et al.",J Immunother Cancer. 2019.,https://pubmed.ncbi.nlm.nih.gov/31511069/,"Fehlings M, Jhunjhunwala S, Kowanetz M, O'Gorman WE, Hegde PS, Sumatoh H, Lee BH, Nardin A, Becht E, Flynn S, Ballinger M, Newell EW, Yadav M.",J Immunother Cancer. 2019 Sep 12;7(1):249. doi: 10.1186/s40425-019-0695-9.
31506382,2019,Engineering γδT cells limits tonic signaling associated with chimeric antigen receptors.,"Fisher J, et al.",Sci Signal. 2019.,https://pubmed.ncbi.nlm.nih.gov/31506382/,"Fisher J, Sharma R, Don DW, Barisa M, Hurtado MO, Abramowski P, Porter L, Day W, Borea R, Inglott S, Anderson J, Pe'er D.",Sci Signal. 2019 Sep 10;12(598):eaax1872. doi: 10.1126/scisignal.aax1872.
31502160,2020,High-Parameter Immune Profiling with CyTOF.,"Sahaf B, et al.",Methods Mol Biol. 2020.,https://pubmed.ncbi.nlm.nih.gov/31502160/,"Sahaf B, Rahman A, Maecker HT, Bendall SC.",Methods Mol Biol. 2020;2055:351-368. doi: 10.1007/978-1-4939-9773-2_16.
31488209,2019,Targeting myeloid-derived suppressor cells in combination with primary mammary tumor resection reduces metastatic growth in the lungs.,"Bosiljcic M, et al.",Breast Cancer Res. 2019.,https://pubmed.ncbi.nlm.nih.gov/31488209/,"Bosiljcic M, Cederberg RA, Hamilton MJ, LePard NE, Harbourne BT, Collier JL, Halvorsen EC, Shi R, Franks SE, Kim AY, Banáth JP, Hamer M, Rossi FM, Bennewith KL.",Breast Cancer Res. 2019 Sep 5;21(1):103. doi: 10.1186/s13058-019-1189-x.
31479536,2019,Highly Stable and Inert Complexation of Indium(III) by Reinforced Cyclam Dipicolinate and a Bifunctional Derivative for Bead Encoding in Mass Cytometry.,"Grenier L, et al.",Chemistry. 2019.,https://pubmed.ncbi.nlm.nih.gov/31479536/,"Grenier L, Beyler M, Platas-Iglesias C, Closson T, Gómez DE, Seferos DS, Liu P, Ornatsky OI, Baranov V, Tripier R.",Chemistry. 2019 Dec 2;25(67):15387-15400. doi: 10.1002/chem.201903969. Epub 2019 Nov 4.
31479470,2019,Methods for analyzing tellurium imaging mass cytometry data.,"Bassan J, et al.",PLoS One. 2019.,https://pubmed.ncbi.nlm.nih.gov/31479470/,"Bassan J, Nitz M.",PLoS One. 2019 Sep 3;14(9):e0221714. doi: 10.1371/journal.pone.0221714. eCollection 2019.
31474997,2019,Early-Life Compartmentalization of Immune Cells in Human Fetal Tissues Revealed by High-Dimensional Mass Cytometry.,"Li N, et al.",Front Immunol. 2019.,https://pubmed.ncbi.nlm.nih.gov/31474997/,"Li N, van Unen V, Guo N, Abdelaal T, Somarakis A, Eggermont J, Mahfouz A, Chuva de Sousa Lopes SM, Lelieveldt BPF, Koning F.",Front Immunol. 2019 Aug 14;10:1932. doi: 10.3389/fimmu.2019.01932. eCollection 2019.
31473121,2019,Importance of Multiparametric Evaluation of Immune-Related T-Cell Markers in Renal-Cell Carcinoma.,"Kawashima A, et al.",Clin Genitourin Cancer. 2019.,https://pubmed.ncbi.nlm.nih.gov/31473121/,"Kawashima A, Uemura M, Nonomura N.",Clin Genitourin Cancer. 2019 Dec;17(6):e1147-e1152. doi: 10.1016/j.clgc.2019.07.021. Epub 2019 Aug 5.
