PMID,Year,Title,short_author,short_citation,link,full_authors,full_citation
33479902,2021,Use of Toll-Like Receptor (TLR) Ligation to Characterize Human Regulatory B-Cells Subsets.,"Chayé MAM, et al.",Methods Mol Biol. 2021.,https://pubmed.ncbi.nlm.nih.gov/33479902/,"Chayé MAM, Tontini C, Ozir-Fazalalikhan A, Voskamp AL, Smits HH.",Methods Mol Biol. 2021;2270:235-261. doi: 10.1007/978-1-0716-1237-8_13.
33476308,2021,Lipid-induced endothelial vascular cell adhesion molecule 1 promotes nonalcoholic steatohepatitis pathogenesis.,"Furuta K, et al.",J Clin Invest. 2021.,https://pubmed.ncbi.nlm.nih.gov/33476308/,"Furuta K, Guo Q, Pavelko KD, Lee JH, Robertson KD, Nakao Y, Melek J, Shah VH, Hirsova P, Ibrahim SH.",J Clin Invest. 2021 Mar 15;131(6):e143690. doi: 10.1172/JCI143690.
33476084,2021,Alternative methods of viability determination in single cell mass cytometry.,"Devine RD, et al.",Cytometry A. 2021.,https://pubmed.ncbi.nlm.nih.gov/33476084/,"Devine RD, Alkhalaileh HS, Lyberger JM, Behbehani GK.",Cytometry A. 2021 Jan 21. doi: 10.1002/cyto.a.24308. Online ahead of print.
33467084,2021,A High-Dimensional Window into the Micro-Environment of Triple Negative Breast Cancer.,"Nederlof I, et al.",Cancers (Basel). 2021.,https://pubmed.ncbi.nlm.nih.gov/33467084/,"Nederlof I, Horlings HM, Curtis C, Kok M.",Cancers (Basel). 2021 Jan 16;13(2):316. doi: 10.3390/cancers13020316.
33461563,2021,Aging and CMV discordance are associated with increased immune diversity between monozygotic twins.,"Yan Z, et al.",Immun Ageing. 2021.,https://pubmed.ncbi.nlm.nih.gov/33461563/,"Yan Z, Maecker HT, Brodin P, Nygaard UC, Lyu SC, Davis MM, Nadeau KC, Andorf S.",Immun Ageing. 2021 Jan 18;18(1):5. doi: 10.1186/s12979-021-00216-1.
33458706,2020,Evaluating cytokine production by flow cytometry using brefeldin A in mice.,"Kovacs SB, et al.",STAR Protoc. 2020.,https://pubmed.ncbi.nlm.nih.gov/33458706/,"Kovacs SB, Oh C, Aachoui Y, Miao EA.",STAR Protoc. 2020 Dec 30;2(1):100244. doi: 10.1016/j.xpro.2020.100244. eCollection 2021 Mar 19.
33458613,2020,Memory CD8+ T cell heterogeneity is primarily driven by pathogen-specific cues and additionally shaped by the tissue environment.,"van der Gracht ETI, et al.",iScience. 2020.,https://pubmed.ncbi.nlm.nih.gov/33458613/,"van der Gracht ETI, Beyrend G, Abdelaal T, Pardieck IN, Wesselink TH, van Haften FJ, van Duikeren S, Koning F, Arens R.",iScience. 2020 Dec 16;24(1):101954. doi: 10.1016/j.isci.2020.101954. eCollection 2021 Jan 22.
33452759,2021,Development and validation of a high-parameter mass cytometry workflow to decipher immunomodulatory changes in celiac disease.,"Estevam J, et al.",Cytometry B Clin Cytom. 2021.,https://pubmed.ncbi.nlm.nih.gov/33452759/,"Estevam J, Krutzik P, Vander Tuig J, McAuliffe WJ, Smithson G.",Cytometry B Clin Cytom. 2021 Jan;100(1):92-102. doi: 10.1002/cyto.b.21986. Epub 2021 Jan 16.
33440137,2021,Taa Cells and Granzyme K: Old Players with New Tricks.,Camell CD.,Immunity. 2021.,https://pubmed.ncbi.nlm.nih.gov/33440137/,Camell CD.,Immunity. 2021 Jan 12;54(1):6-8. doi: 10.1016/j.immuni.2020.12.008.
33437968,2020,Enriching for human acute myeloid leukemia stem cells using reactive oxygen species-based cell sorting.,"Stevens BM, et al.",STAR Protoc. 2020.,https://pubmed.ncbi.nlm.nih.gov/33437968/,"Stevens BM, O'Brien C, Jordan CT, Jones CL.",STAR Protoc. 2020 Dec 30;2(1):100248. doi: 10.1016/j.xpro.2020.100248. eCollection 2021 Mar 19.
33437482,2021,Successful identification of predictive profiles for infection utilising systems-level immune analysis: a pilot study in patients with relapsed and refractory multiple myeloma.,"Doerflinger M, et al.",Clin Transl Immunology. 2021.,https://pubmed.ncbi.nlm.nih.gov/33437482/,"Doerflinger M, Garnham AL, Freytag S, Harrison SJ, Prince HM, Quach H, Slavin MA, Pellegrini M, Teh BW.",Clin Transl Immunology. 2021 Jan 7;10(1):e1235. doi: 10.1002/cti2.1235. eCollection 2021.
33377120,2020,Optimized workflow for single-cell transcriptomics on infectious diseases including COVID-19.,"De Domenico E, et al.",STAR Protoc. 2020.,https://pubmed.ncbi.nlm.nih.gov/33377120/,"De Domenico E, Bonaguro L, Schulte-Schrepping J, Becker M, Händler K, Schultze JL.",STAR Protoc. 2020 Dec 16;1(3):100233. doi: 10.1016/j.xpro.2020.100233. eCollection 2020 Dec 18.
33377064,2020,Glutathione Quantification in Live Cells with Real-Time Imaging and Flow Cytometry.,"Jiang X, et al.",STAR Protoc. 2020.,https://pubmed.ncbi.nlm.nih.gov/33377064/,"Jiang X, Chen J, Wang MC, Wang J.",STAR Protoc. 2020 Nov 14;1(3):100170. doi: 10.1016/j.xpro.2020.100170. eCollection 2020 Dec 18.
33294866,2020,Pancreatlas: Applying an Adaptable Framework to Map the Human Pancreas in Health and Disease.,"Saunders DC, et al.",Patterns (N Y). 2020.,https://pubmed.ncbi.nlm.nih.gov/33294866/,"Saunders DC, Messmer J, Kusmartseva I, Beery ML, Yang M, Atkinson MA, Powers AC, Cartailler JP, Brissova M.",Patterns (N Y). 2020 Oct 5;1(8):100120. doi: 10.1016/j.patter.2020.100120. eCollection 2020 Nov 13.
33431933,2021,Potentiality of multiple modalities for single-cell analyses to evaluate the tumor microenvironment in clinical specimens.,"Kashima Y, et al.",Sci Rep. 2021.,https://pubmed.ncbi.nlm.nih.gov/33431933/,"Kashima Y, Togashi Y, Fukuoka S, Kamada T, Irie T, Suzuki A, Nakamura Y, Shitara K, Minamide T, Yoshida T, Taoka N, Kawase T, Wada T, Inaki K, Chihara M, Ebisuno Y, Tsukamoto S, Fujii R, Ohashi A, Suzuki Y, Tsuchihara K, Nishikawa H, Doi T.",Sci Rep. 2021 Jan 11;11(1):341. doi: 10.1038/s41598-020-79385-w.
33424833,2020,Vi-Vaccinations Induce Heterogeneous Plasma Cell Responses That Associate With Protection From Typhoid Fever.,"Cross DL, et al.",Front Immunol. 2020.,https://pubmed.ncbi.nlm.nih.gov/33424833/,"Cross DL, Verheul MK, Leipold MD, Obermoser G, Jin C, Jones E, Starr JS, Mohorianu I, Blohmke CJ, Maecker HT, Napolitani G, Hill J, Pollard AJ.",Front Immunol. 2020 Dec 3;11:574057. doi: 10.3389/fimmu.2020.574057. eCollection 2020.
33424804,2020,Imaging Mass Cytometric Analysis of Postmortem Tissues Reveals Dysregulated Immune Cell and Cytokine Responses in Multiple Organs of COVID-19 Patients.,"Wang C, et al.",Front Microbiol. 2020.,https://pubmed.ncbi.nlm.nih.gov/33424804/,"Wang C, Xu J, Wang S, Pan S, Zhang J, Han Y, Huang M, Wu D, Yang Q, Yang X, Yang Y, Shu T, Zou X, Li R, Luo Y, Yao R, Wang Y, Qiu Y, Wang Y, Zhang DY, Yao Q, Yan Y, Zhou X, Shang Y.",Front Microbiol. 2020 Dec 23;11:600989. doi: 10.3389/fmicb.2020.600989. eCollection 2020.
33414384,2021,SARS-CoV-2 infection is associated with a pro-thrombotic platelet phenotype.,"Bongiovanni D, et al.",Cell Death Dis. 2021.,https://pubmed.ncbi.nlm.nih.gov/33414384/,"Bongiovanni D, Klug M, Lazareva O, Weidlich S, Biasi M, Ursu S, Warth S, Buske C, Lukas M, Spinner CD, Scheidt MV, Condorelli G, Baumbach J, Laugwitz KL, List M, Bernlochner I.",Cell Death Dis. 2021 Jan 5;12(1):50. doi: 10.1038/s41419-020-03333-9.
33408092,2021,Skin dendritic cells in melanoma are key for successful checkpoint blockade therapy.,"Prokopi A, et al.",J Immunother Cancer. 2021.,https://pubmed.ncbi.nlm.nih.gov/33408092/,"Prokopi A, Tripp CH, Tummers B, Hornsteiner F, Spoeck S, Crawford JC, Clements DR, Efremova M, Hutter K, Bellmann L, Cappellano G, Cadilha BL, Kobold S, Boon L, Ortner D, Trajanoski Z, Chen S, de Gruijl TD, Idoyaga J, Green DR, Stoitzner P.",J Immunother Cancer. 2021 Jan;9(1):e000832. doi: 10.1136/jitc-2020-000832.
33407847,2021,Identification of ALP+/CD73+ defining markers for enhanced osteogenic potential in human adipose-derived mesenchymal stromal cells by mass cytometry.,"Canepa DD, et al.",Stem Cell Res Ther. 2021.,https://pubmed.ncbi.nlm.nih.gov/33407847/,"Canepa DD, Casanova EA, Arvaniti E, Tosevski V, Märsmann S, Eggerschwiler B, Halvachizadeh S, Buschmann J, Barth AA, Plock JA, Claassen M, Pape HC, Cinelli P.",Stem Cell Res Ther. 2021 Jan 6;12(1):7. doi: 10.1186/s13287-020-02044-4.
33402212,2021,Microglial deletion and inhibition alleviate behavior of post-traumatic stress disorder in mice.,"Li S, et al.",J Neuroinflammation. 2021.,https://pubmed.ncbi.nlm.nih.gov/33402212/,"Li S, Liao Y, Dong Y, Li X, Li J, Cheng Y, Cheng J, Yuan Z.",J Neuroinflammation. 2021 Jan 5;18(1):7. doi: 10.1186/s12974-020-02069-9.
33400685,2021,Defining phenotypic and functional heterogeneity of glioblastoma stem cells by mass cytometry.,"Galdieri L, et al.",JCI Insight. 2021.,https://pubmed.ncbi.nlm.nih.gov/33400685/,"Galdieri L, Jash A, Malkova O, Mao DD, DeSouza P, Chu YE, Salter A, Campian JL, Naegle KM, Brennan CW, Wakimoto H, Oh ST, Kim AH, Chheda MG.",JCI Insight. 2021 Feb 22;6(4):e128456. doi: 10.1172/jci.insight.128456.
33399275,2021,"Platelet mass cytometry: Optimization of sample, reagent, and analysis parameters.","Spurgeon BEJ, et al.",Cytometry A. 2021.,https://pubmed.ncbi.nlm.nih.gov/33399275/,"Spurgeon BEJ, Michelson AD, Frelinger AL 3rd.",Cytometry A. 2021 Feb;99(2):170-179. doi: 10.1002/cyto.a.24300. Epub 2021 Jan 5.
33395934,2021,Immune cell profiles associated with measured exposure to phthalates in the Norwegian EuroMix biomonitoring study - A mass cytometry approach in toxicology.,"Nygaard UC, et al.",Environ Int. 2021.,https://pubmed.ncbi.nlm.nih.gov/33395934/,"Nygaard UC, Ulriksen ES, Hjertholm H, Sonnet F, Bølling AK, Andreassen M, Husøy T, Dirven H.",Environ Int. 2021 Jan;146:106283. doi: 10.1016/j.envint.2020.106283. Epub 2020 Dec 2.
33391261,2020,The T Cell Receptor Immune Repertoire Protects the Liver From Reconsitution.,"Liang Q, et al.",Front Immunol. 2020.,https://pubmed.ncbi.nlm.nih.gov/33391261/,"Liang Q, Hu Y, Zhang M, Lin C, Zhang W, Li Y, Zhu P, Xue P, Chen Y, Li Q, Wang K.",Front Immunol. 2020 Dec 18;11:584979. doi: 10.3389/fimmu.2020.584979. eCollection 2020.
33381818,2020,SCIM: universal single-cell matching with unpaired feature sets.,"Stark SG, et al.",Bioinformatics. 2020.,https://pubmed.ncbi.nlm.nih.gov/33381818/,"Stark SG, Ficek J, Locatello F, Bonilla X, Chevrier S, Singer F; Tumor Profiler Consortium, Rätsch G, Lehmann KV.",Bioinformatics. 2020 Dec 30;36(Suppl_2):i919-i927. doi: 10.1093/bioinformatics/btaa843.
33377108,2020,Generation and isolation of single cells from mouse brain with mosaic analysis with double markers-induced uniparental chromosome disomy.,"Laukoter S, et al.",STAR Protoc. 2020.,https://pubmed.ncbi.nlm.nih.gov/33377108/,"Laukoter S, Amberg N, Pauler FM, Hippenmeyer S.",STAR Protoc. 2020 Dec 16;1(3):100215. doi: 10.1016/j.xpro.2020.100215. eCollection 2020 Dec 18.
33377105,2020,Protocol for brain-wide or region-specific microglia depletion and repopulation in adult mice.,"Willis EF, et al.",STAR Protoc. 2020.,https://pubmed.ncbi.nlm.nih.gov/33377105/,"Willis EF, Vukovic J.",STAR Protoc. 2020 Dec 13;1(3):100211. doi: 10.1016/j.xpro.2020.100211. eCollection 2020 Dec 18.
33377089,2020,"Assessing IL-2-Induced STAT5 Phosphorylation in Fixed, Permeabilized Foxp3(+) Treg Cells by Multiparameter Flow Cytometry.","Li C, et al.",STAR Protoc. 2020.,https://pubmed.ncbi.nlm.nih.gov/33377089/,"Li C, Park JH.",STAR Protoc. 2020 Dec 1;1(3):100195. doi: 10.1016/j.xpro.2020.100195. eCollection 2020 Dec 18.
33377082,2020,Intratumoral Monocyte Transfer to Examine Monocyte Differentiation in the Tumor Microenvironment.,"Devalaraja S, et al.",STAR Protoc. 2020.,https://pubmed.ncbi.nlm.nih.gov/33377082/,"Devalaraja S, Haldar M.",STAR Protoc. 2020 Dec 3;1(3):100188. doi: 10.1016/j.xpro.2020.100188. eCollection 2020 Dec 18.
33377078,2020,"De Novo Generation of Murine and Human MADR Recipient Cell Lines for Locus-Specific, Stable Integration of Transgenic Elements.","Ayala-Sarmiento AE, et al.",STAR Protoc. 2020.,https://pubmed.ncbi.nlm.nih.gov/33377078/,"Ayala-Sarmiento AE, Kobritz N, Breunig JJ.",STAR Protoc. 2020 Nov 25;1(3):100184. doi: 10.1016/j.xpro.2020.100184. eCollection 2020 Dec 18.
33370459,2021,Mass cytometry reveals unique subsets of T cells and lymphoid cells in nasal polyps from patients with chronic rhinosinusitis (CRS).,"Bartemes KR, et al.",Allergy. 2021.,https://pubmed.ncbi.nlm.nih.gov/33370459/,"Bartemes KR, Choby G, O'Brien EK, Stokken JK, Pavelko KD, Kita H.",Allergy. 2021 Jul;76(7):2222-2226. doi: 10.1111/all.14720. Epub 2021 Jan 19.
33367748,2020,Cytomapper: an R/bioconductor package for visualisation of highly multiplexed imaging data.,"Eling N, et al.",Bioinformatics. 2020.,https://pubmed.ncbi.nlm.nih.gov/33367748/,"Eling N, Damond N, Hoch T, Bodenmiller B.",Bioinformatics. 2020 Dec 26;36(24):5706-8. doi: 10.1093/bioinformatics/btaa1061. Online ahead of print.
33348978,2021,Nonspecific Binding Correction for Single-Cell Mass Cytometric Analysis of Autophagy and Myoblast Differentiation.,"Brown HMG, et al.",Anal Chem. 2021.,https://pubmed.ncbi.nlm.nih.gov/33348978/,"Brown HMG, Kuhns MM, Maxwell Z, Arriaga EA.",Anal Chem. 2021 Jan 26;93(3):1401-1408. doi: 10.1021/acs.analchem.0c03211. Epub 2020 Dec 22.
33345329,2021,Comprehensive mapping of immune tolerance yields a regulatory TNF receptor 2 signature in a murine model of successful Fel d 1-specific immunotherapy using high-dose CpG adjuvant.,"Leonard C, et al.",Allergy. 2021.,https://pubmed.ncbi.nlm.nih.gov/33345329/,"Leonard C, Montamat G, Davril C, Domingues O, Hunewald O, Revets D, Guerin C, Blank S, Heckendorn J, Jardon G, Hentges F, Ollert M.",Allergy. 2021 Jul;76(7):2153-2165. doi: 10.1111/all.14716. Epub 2021 Jan 5.
33342071,2021,Ab initio spillover compensation in mass cytometry data.,"Miao Q, et al.",Cytometry A. 2021.,https://pubmed.ncbi.nlm.nih.gov/33342071/,"Miao Q, Wang F, Dou J, Iqbal R, Muftuoglu M, Basar R, Li L, Rezvani K, Chen K.",Cytometry A. 2021 Sep;99(9):899-909. doi: 10.1002/cyto.a.24298. Epub 2020 Dec 31.
33329028,2020,Mechanistic Model of Signaling Dynamics Across an Epithelial Mesenchymal Transition.,"Wade JD, et al.",Front Physiol. 2020.,https://pubmed.ncbi.nlm.nih.gov/33329028/,"Wade JD, Lun XK, Zivanovic N, Voit EO, Bodenmiller B.",Front Physiol. 2020 Nov 30;11:579117. doi: 10.3389/fphys.2020.579117. eCollection 2020.
33327433,2020,The Evolving Knowledge on T and NK Cells in Classic Hodgkin Lymphoma: Insights into Novel Subsets Populating the Immune Microenvironment.,"Ferrarini I, et al.",Cancers (Basel). 2020.,https://pubmed.ncbi.nlm.nih.gov/33327433/,"Ferrarini I, Rigo A, Visco C, Krampera M, Vinante F.",Cancers (Basel). 2020 Dec 14;12(12):3757. doi: 10.3390/cancers12123757.
33320535,2021,Mass Cytometry Tags: Where Chemistry Meets Single-Cell Analysis.,"Delgado-Gonzalez A, et al.",Anal Chem. 2021.,https://pubmed.ncbi.nlm.nih.gov/33320535/,"Delgado-Gonzalez A, Sanchez-Martin RM.",Anal Chem. 2021 Jan 19;93(2):657-664. doi: 10.1021/acs.analchem.0c03560. Epub 2020 Dec 15.
33317179,2020,Single Cell Detection of the p53 Protein by Mass Cytometry.,"Fagerholt OHE, et al.",Cancers (Basel). 2020.,https://pubmed.ncbi.nlm.nih.gov/33317179/,"Fagerholt OHE, Hellesøy M, Gullaksen SE, Gjertsen BT.",Cancers (Basel). 2020 Dec 9;12(12):3699. doi: 10.3390/cancers12123699.
33310880,2020,Mass Cytometry Defines Virus-Specific CD4(+) T Cells in Influenza Vaccination.,"Subrahmanyam PB, et al.",Immunohorizons. 2020.,https://pubmed.ncbi.nlm.nih.gov/33310880/,"Subrahmanyam PB, Holmes TH, Lin D, Su LF, Obermoser G, Banchereau J, Pascual V, García-Sastre A, Albrecht RA, Palucka K, Davis MM, Maecker HT.",Immunohorizons. 2020 Dec 11;4(12):774-788. doi: 10.4049/immunohorizons.1900097.
33307272,2021,Changing the landscape of tumor immunology: novel tools to examine T cell specificity.,"Rahman MA, et al.",Curr Opin Immunol. 2021.,https://pubmed.ncbi.nlm.nih.gov/33307272/,"Rahman MA, Murata K, Burt BD, Hirano N.",Curr Opin Immunol. 2021 Apr;69:1-9. doi: 10.1016/j.coi.2020.11.003. Epub 2020 Dec 8.
33307028,2021,Cadherin 11 Promotes Immunosuppression and Extracellular Matrix Deposition to Support Growth of Pancreatic Tumors and Resistance to Gemcitabine in Mice.,"Peran I, et al.",Gastroenterology. 2021.,https://pubmed.ncbi.nlm.nih.gov/33307028/,"Peran I, Dakshanamurthy S, McCoy MD, Mavropoulos A, Allo B, Sebastian A, Hum NR, Sprague SC, Martin KA, Pishvaian MJ, Vietsch EE, Wellstein A, Atkins MB, Weiner LM, Quong AA, Loots GG, Yoo SS, Assefnia S, Byers SW.",Gastroenterology. 2021 Mar;160(4):1359-1372.e13. doi: 10.1053/j.gastro.2020.11.044. Epub 2020 Dec 9.
33294774,2020,Integration of mechanistic immunological knowledge into a machine learning pipeline improves predictions.,"Culos A, et al.",Nat Mach Intell. 2020.,https://pubmed.ncbi.nlm.nih.gov/33294774/,"Culos A, Tsai AS, Stanley N, Becker M, Ghaemi MS, McIlwain DR, Fallahzadeh R, Tanada A, Nassar H, Espinosa C, Xenochristou M, Ganio E, Peterson L, Han X, Stelzer IA, Ando K, Gaudilliere D, Phongpreecha T, Marić I, Chang AL, Shaw GM, Stevenson DK, Bendall S, Davis KL, Fantl W, Nolan GP, Hastie T, Tibshirani R, Angst MS, Gaudilliere B, Aghaeepour N.",Nat Mach Intell. 2020 Oct;2(10):619-628. doi: 10.1038/s42256-020-00232-8. Epub 2020 Oct 12.
33289101,2021,Enlightening human B-cell diversity.,"Soleto I, et al.",Allergy. 2021.,https://pubmed.ncbi.nlm.nih.gov/33289101/,"Soleto I, Jiménez-Saiz R, Carrasco YR.",Allergy. 2021 Aug;76(8):2644-2646. doi: 10.1111/all.14685. Epub 2020 Dec 23.
33288545,2021,SLAMF7 Signaling Reprograms T Cells toward Exhaustion in the Tumor Microenvironment.,"O'Connell P, et al.",J Immunol. 2021.,https://pubmed.ncbi.nlm.nih.gov/33288545/,"O'Connell P, Hyslop S, Blake MK, Godbehere S, Amalfitano A, Aldhamen YA.",J Immunol. 2021 Jan 1;206(1):193-205. doi: 10.4049/jimmunol.2000300. Epub 2020 Dec 7.
33283785,2020,Profiling of the Human Natural Killer Cell Receptor-Ligand Repertoire.,"Vendrame E, et al.",J Vis Exp. 2020.,https://pubmed.ncbi.nlm.nih.gov/33283785/,"Vendrame E, McKechnie JL, Ranganath T, Zhao NQ, Rustagi A, Vergara R, Ivison GT, Kronstad LM, Simpson LJ, Blish CA.",J Vis Exp. 2020 Nov 19;(165):10.3791/61912. doi: 10.3791/61912.
33268029,2021,Cellular immunotherapy with multiple infusions of in vitro-expanded haploidentical natural killer cells after autologous transplantation for patients with plasma cell myeloma.,"Tschan-Plessl A, et al.",Cytotherapy. 2021.,https://pubmed.ncbi.nlm.nih.gov/33268029/,"Tschan-Plessl A, Kalberer CP, Wieboldt R, Stern M, Siegler U, Wodnar-Filipowicz A, Gerull S, Halter J, Heim D, Tichelli A, Tsakiris DA, Malmberg KJ, Passweg JR, Bottos A.",Cytotherapy. 2021 Apr;23(4):329-338. doi: 10.1016/j.jcyt.2020.09.009. Epub 2020 Nov 29.
33267666,2021,Heterogeneity of T Cells in Atherosclerosis Defined by Single-Cell RNA-Sequencing and Cytometry by Time of Flight.,"Winkels H, et al.",Arterioscler Thromb Vasc Biol. 2021.,https://pubmed.ncbi.nlm.nih.gov/33267666/,"Winkels H, Wolf D.",Arterioscler Thromb Vasc Biol. 2021 Feb;41(2):549-563. doi: 10.1161/ATVBAHA.120.312137. Epub 2020 Dec 3.
33251927,2020,Single-Cell Immune Profiling in Coronary Artery Disease: The Role of State-of-the-Art Immunophenotyping With Mass Cytometry in the Diagnosis of Atherosclerosis.,"Kott KA, et al.",J Am Heart Assoc. 2020.,https://pubmed.ncbi.nlm.nih.gov/33251927/,"Kott KA, Vernon ST, Hansen T, de Dreu M, Das SK, Powell J, Fazekas de St Groth B, Di Bartolo BA, McGuire HM, Figtree GA.",J Am Heart Assoc. 2020 Dec 15;9(24):e017759. doi: 10.1161/JAHA.120.017759. Epub 2020 Nov 30.
33244139,2020,UBC9 coordinates inflammation affecting development of bladder cancer.,"Huang X, et al.",Sci Rep. 2020.,https://pubmed.ncbi.nlm.nih.gov/33244139/,"Huang X, Tao Y, Gao J, Zhou X, Tang S, Deng C, Lai Z, Lin X, Wang Q, Li T.",Sci Rep. 2020 Nov 26;10(1):20670. doi: 10.1038/s41598-020-77623-9.
33240276,2020,Microglia Diversity in Health and Multiple Sclerosis.,"Zia S, et al.",Front Immunol. 2020.,https://pubmed.ncbi.nlm.nih.gov/33240276/,"Zia S, Rawji KS, Michaels NJ, Burr M, Kerr BJ, Healy LM, Plemel JR.",Front Immunol. 2020 Nov 6;11:588021. doi: 10.3389/fimmu.2020.588021. eCollection 2020.
33237547,2021,High-Dimensional Analysis of Circulating and Tissue-Derived Myeloid-Derived Suppressor Cells from Patients with Glioblastoma.,"Alban TJ, et al.",Methods Mol Biol. 2021.,https://pubmed.ncbi.nlm.nih.gov/33237547/,"Alban TJ, Bayik D, Alvarado AG, Kornblum HI, Lathia JD.",Methods Mol Biol. 2021;2236:157-175. doi: 10.1007/978-1-0716-1060-2_13.
33237540,2021,High-Dimensional Phenotyping of Human Myeloid-Derived Suppressor Cells/Tumor-Associated Macrophages in Tissue by Mass Cytometry.,"Ferrant J, et al.",Methods Mol Biol. 2021.,https://pubmed.ncbi.nlm.nih.gov/33237540/,"Ferrant J, Le Gallou S, Manson G, Genebrier S, Mourcin F, Tarte K, Roussel M.",Methods Mol Biol. 2021;2236:57-66. doi: 10.1007/978-1-0716-1060-2_6.
33235273,2020,High CD45 expression of CD8+ and CD4+ T cells correlates with the size of HIV-1 reservoir in blood.,"Petkov S, et al.",Sci Rep. 2020.,https://pubmed.ncbi.nlm.nih.gov/33235273/,"Petkov S, Bekele Y, Lakshmikanth T, Hejdeman B, Zazzi M, Brodin P, Chiodi F.",Sci Rep. 2020 Nov 24;10(1):20425. doi: 10.1038/s41598-020-77433-z.
33231295,2021,Deep phenotypical characterization of human CD3(+) CD56(+) T cells by mass cytometry.,"Romero-Olmedo AJ, et al.",Eur J Immunol. 2021.,https://pubmed.ncbi.nlm.nih.gov/33231295/,"Romero-Olmedo AJ, Schulz AR, Huber M, Brehm CU, Chang HD, Chiarolla CM, Bopp T, Skevaki C, Berberich-Siebelt F, Radbruch A, Mei HE, Lohoff M.",Eur J Immunol. 2021 Mar;51(3):672-681. doi: 10.1002/eji.202048941. Epub 2020 Dec 15.
33229441,2021,Multibatch Cytometry Data Integration for Optimal Immunophenotyping.,"Ogishi M, et al.",J Immunol. 2021.,https://pubmed.ncbi.nlm.nih.gov/33229441/,"Ogishi M, Yang R, Gruber C, Zhang P, Pelham SJ, Spaan AN, Rosain J, Chbihi M, Han JE, Rao VK, Kainulainen L, Bustamante J, Boisson B, Bogunovic D, Boisson-Dupuis S, Casanova JL.",J Immunol. 2021 Jan 1;206(1):206-213. doi: 10.4049/jimmunol.2000854. Epub 2020 Nov 23.
33226128,2021,Mass cytometry analysis of blood immune cells from psoriasis patients on biological therapy.,"Solberg SM, et al.",Eur J Immunol. 2021.,https://pubmed.ncbi.nlm.nih.gov/33226128/,"Solberg SM, Aarebrot AK, Sarkar I, Petrovic A, Sandvik LF, Bergum B, Jonsson R, Bryceson YT, Appel S.",Eur J Immunol. 2021 Mar;51(3):694-702. doi: 10.1002/eji.202048857. Epub 2021 Jan 21.
33205814,2020,GigaSOM.jl: High-performance clustering and visualization of huge cytometry datasets.,"Kratochvíl M, et al.",Gigascience. 2020.,https://pubmed.ncbi.nlm.nih.gov/33205814/,"Kratochvíl M, Hunewald O, Heirendt L, Verissimo V, Vondrášek J, Satagopam VP, Schneider R, Trefois C, Ollert M.",Gigascience. 2020 Nov 18;9(11):giaa127. doi: 10.1093/gigascience/giaa127.
33205351,2021,Multidimensional Proteomic Approach of Endothelial Progenitors Demonstrate Expression of KDR Restricted to CD19 Cells.,"Guerin CL, et al.",Stem Cell Rev Rep. 2021.,https://pubmed.ncbi.nlm.nih.gov/33205351/,"Guerin CL, Guyonnet L, Goudot G, Revets D, Konstantinou M, Chipont A, Chocron R, Blandinieres A, Khider L, Rancic J, Peronino C, Debuc B, Cras A, Knosp C, Latremouille C, Capel A, Ollert M, Diehl JL, Jansen P, Planquette B, Sanchez O, Gaussem P, Mirault T, Carpentier A, Gendron N, Smadja DM.",Stem Cell Rev Rep. 2021 Apr;17(2):639-651. doi: 10.1007/s12015-020-10062-1. Epub 2020 Nov 17.
33205061,2020,Human Tumor-Infiltrating MAIT Cells Display Hallmarks of Bacterial Antigen Recognition in Colorectal Cancer.,"Li S, et al.",Cell Rep Med. 2020.,https://pubmed.ncbi.nlm.nih.gov/33205061/,"Li S, Simoni Y, Becht E, Loh CY, Li N, Lachance D, Koo SL, Lim TP, Tan EKW, Mathew R, Nguyen A, Golovato J, Berkson JD, Prlic M, Lee B, Minot SS, Nagarajan N, Dey N, Tan DSW, Tan IB, Newell EW.",Cell Rep Med. 2020 Jun 23;1(3):100039. doi: 10.1016/j.xcrm.2020.100039. eCollection 2020 Jun 23.
33205028,2020,Mass Cytometry Phenotyping of Human Granulocytes Reveals Novel Basophil Functional Heterogeneity.,"Vivanco Gonzalez N, et al.",iScience. 2020.,https://pubmed.ncbi.nlm.nih.gov/33205028/,"Vivanco Gonzalez N, Oliveria JP, Tebaykin D, Ivison GT, Mukai K, Tsai MM, Borges L, Nadeau KC, Galli SJ, Tsai AG, Bendall SC.",iScience. 2020 Oct 22;23(11):101724. doi: 10.1016/j.isci.2020.101724. eCollection 2020 Nov 20.
33193376,2020,Method for the Analysis of the Tumor Microenvironment by Mass Cytometry: Application to Chronic Lymphocytic Leukemia.,"Gonder S, et al.",Front Immunol. 2020.,https://pubmed.ncbi.nlm.nih.gov/33193376/,"Gonder S, Fernandez Botana I, Wierz M, Pagano G, Gargiulo E, Cosma A, Moussay E, Paggetti J, Largeot A.",Front Immunol. 2020 Oct 20;11:578176. doi: 10.3389/fimmu.2020.578176. eCollection 2020.
33193353,2020,Visualizing Dynamic Changes at the Maternal-Fetal Interface Throughout Human Pregnancy by Mass Cytometry.,"van der Zwan A, et al.",Front Immunol. 2020.,https://pubmed.ncbi.nlm.nih.gov/33193353/,"van der Zwan A, van Unen V, Beyrend G, Laban S, van der Keur C, Kapsenberg HJM, Höllt T, Chuva de Sousa Lopes SM, van der Hoorn MP, Koning F, Claas FHJ, Eikmans M, Heidt S.",Front Immunol. 2020 Oct 26;11:571300. doi: 10.3389/fimmu.2020.571300. eCollection 2020.
33187367,2020,Integrated Single-Cell RNA-Sequencing Analysis of Aquaporin 5-Expressing Mouse Lung Epithelial Cells Identifies GPRC5A as a Novel Validated Type I Cell Surface Marker.,"Horie M, et al.",Cells. 2020.,https://pubmed.ncbi.nlm.nih.gov/33187367/,"Horie M, Castaldi A, Sunohara M, Wang H, Ji Y, Liu Y, Li F, Wilkinson TA, Hung L, Shen H, Kage H, Offringa IA, Marconett CN, Flodby P, Zhou B, Borok Z.",Cells. 2020 Nov 11;9(11):2460. doi: 10.3390/cells9112460.
33175466,2021,Shared Resource Laboratory Operations: Changes Made During Initial Global COVID-19 Lockdown of 2020.,"Back JB, et al.",Cytometry A. 2021.,https://pubmed.ncbi.nlm.nih.gov/33175466/,"Back JB, Chadick CH, Garcia Vallejo JJ, Orlowski-Oliver E, Patel R, Roe CE, Srivastava J, Walker RV.",Cytometry A. 2021 Jan;99(1):22-32. doi: 10.1002/cyto.a.24261. Epub 2020 Nov 27.
33165843,2021,Mass Cytometry of Hematopoietic Cells.,"Jager A, et al.",Methods Mol Biol. 2021.,https://pubmed.ncbi.nlm.nih.gov/33165843/,"Jager A, Sarno J, Davis KL.",Methods Mol Biol. 2021;2185:65-76. doi: 10.1007/978-1-0716-0810-4_5.
